{
  "week": "2026-W25",
  "from": "2026-06-15",
  "to": "2026-06-21",
  "generated_at": "2026-06-21T05:00:00+09:00",
  "schema_version": "1.0",
  "headline": "米政府のFable 5輸出規制停止・Z.aiのGLM-5.2即座反攻・SpaceXのCursor買収・ノーベル賞受賞者のAnthropic移籍が重なり、AI覇権争いが地政学・商業・人材の三戦線に拡大した週",
  "summary_ja": "2026年第25週は、米政府によるClaude Fable 5・Mythos 5輸出規制停止を起点に、AI業界の全戦線が同時に動いた週となった。輸出管理命令はAnthropicに90分以内のアクセス制限実装を要求し、再公開条件「ジェイルブレーク完全遮断」を専門家が技術的不可能と指摘する中、交渉は平行線をたどった。この空白に中国Z.aiがGLM-5.2（753B MoE、MIT無償公開）を即座に投入。Artificial Analysisでフロンティアモデルに肉薄すると評価され、2026年末のFable相当OSS公開も予告された。商業面ではSpaceXがCursorを600億ドルで買収しMusk勢力が開発者市場に参入。2024年ノーベル化学賞受賞・AlphaFold共同開発者ジャンパー氏がAnthropicへ移籍し創薬AIへの布石とみられる。DeepMindはAIエージェント安全制御ロードマップv0.1を公開、OpenAIはGPT-5.4が実験室で医薬品化学の新知見を発見したと報告。規制・競争・人材・安全の全領域が連鎖した歴史的一週間となった。",
  "stats": {
    "total_collected_week": 140,
    "after_dedup": 135,
    "selected_items": 29,
    "top_count": 10
  },
  "top_10": [
    {
      "id": "tc-anthropic-wh-ban",
      "date": "2026-06-16",
      "rank": 1,
      "reason": "今週最大のニュース。米政府がClaude Fable 5・Mythos 5へのグローバルアクセスを90分で停止させた輸出管理命令。AIフロンティアモデルへの政府介入という前代未聞の前例",
      "category": "regulation_policy"
    },
    {
      "id": "gigazine-glm-5-2",
      "date": "2026-06-16",
      "rank": 2,
      "reason": "Fable 5停止直後に中国Z.aiが744B MoE・MIT無償公開のGLM-5.2を発表。規制の空白をOSSが埋める構図の象徴的ニュース",
      "category": "new_models"
    },
    {
      "id": "apple-foundation-models",
      "date": "2026-06-16",
      "rank": 3,
      "reason": "WWDCでAppleがFoundation ModelsをOSS化。単一Swift APIでオンデバイス・Claude・Geminiを切替可能にする開発者インフラの転換点",
      "category": "tools_apps"
    },
    {
      "id": "ars-spacex-cursor-60b",
      "date": "2026-06-17",
      "rank": 4,
      "reason": "SpaceX上場2日後に600億ドルの全株式交換でCursorを買収。Musk率いるxAI・Tesla・SpaceXの三角形がAI開発者市場に本格参入",
      "category": "industry_business"
    },
    {
      "id": "ls-fable5-mythos-safe",
      "date": "2026-06-17",
      "rank": 5,
      "reason": "Latent SpaceによるFable 5の技術的深掘り。FrontierCode Diamondで13.4%→29.3%の達成と論争的条件の実態を解説。停止3日前の決定版技術分析",
      "category": "new_models"
    },
    {
      "id": "raschka-2026-llm-list",
      "date": "2026-06-17",
      "rank": 6,
      "reason": "Sebastian Raschkaが2026年1〜5月のLLM精選論文リストを公開。score=19で今週最高スコア。研究者・エンジニアの必読キャッチアップリソース",
      "category": "research_papers"
    },
    {
      "id": "ars-openai-financial-leak",
      "date": "2026-06-17",
      "rank": 7,
      "reason": "OpenAI内部財務文書が流出。2024年37億→2025年130億ドルの急成長も支出超で赤字継続。IPO前哨戦の実態が明らかに",
      "category": "industry_business"
    },
    {
      "id": "2026-06-21-012",
      "date": "2026-06-21",
      "rank": 8,
      "reason": "2024年ノーベル化学賞受賞・AlphaFold共同開発者ジョン・ジャンパー氏がDeepMind→Anthropicへ移籍。AI創薬・タンパク質設計での戦略的布石",
      "category": "industry_business"
    },
    {
      "id": "2026-06-21-005",
      "date": "2026-06-21",
      "rank": 9,
      "reason": "Google DeepMindがAIエージェント安全制御ロードマップv0.1を公開。100万件の軌跡データ解析・MITRE ATT&CK適用の実証的3層防御設計",
      "category": "agents"
    },
    {
      "id": "2026-06-21-006",
      "date": "2026-06-21",
      "rank": 10,
      "reason": "OpenAI GPT-5.4が近自律エージェントとして1万件超の実験室実験を実施し、医薬品化学でTEMPOを新知見として発見。LLMが実湿式実験を主導した初の公開記録",
      "category": "agents"
    }
  ],
  "papers_5": [
    {
      "id": "raschka-2026-llm-list",
      "date": "2026-06-17",
      "category": "research_papers"
    },
    {
      "id": "2026-06-21-011",
      "date": "2026-06-21",
      "category": "research_papers"
    },
    {
      "id": "arxiv-a-red-team-study-of-anthropic-fable-5-opus-4-8-m",
      "date": "2026-06-18",
      "category": "research_papers"
    },
    {
      "id": "arxiv-looped-world-models",
      "date": "2026-06-18",
      "category": "research_papers"
    },
    {
      "id": "arxiv-detecting-hidden-ml-training-with-zero-overhead-",
      "date": "2026-06-19",
      "category": "research_papers"
    },
    {
      "id": "2026-06-21-009",
      "date": "2026-06-21",
      "category": "research_papers"
    }
  ],
  "models_3": [
    {
      "id": "gigazine-glm-5-2",
      "date": "2026-06-16",
      "category": "new_models"
    },
    {
      "id": "2026-06-21-001",
      "date": "2026-06-21",
      "category": "new_models"
    },
    {
      "id": "gigazine-kimi-k2-7",
      "date": "2026-06-16",
      "category": "new_models"
    }
  ],
  "community_buzz_3": [
    {
      "id": "2026-06-21-016",
      "date": "2026-06-21",
      "category": "community_buzz"
    },
    {
      "id": "2026-06-21-015",
      "date": "2026-06-21",
      "category": "community_buzz"
    },
    {
      "id": "lesswrong-claude-fable-5-and-mythos-5-capabilities",
      "date": "2026-06-20",
      "category": "community_buzz"
    }
  ],
  "japan_3": [
    {
      "id": "2026-06-21-017",
      "date": "2026-06-21",
      "category": "japan"
    },
    {
      "id": "hatena_it-5-claude-code-tips-2",
      "date": "2026-06-18",
      "category": "japan"
    },
    {
      "id": "hatena-codex-skill",
      "date": "2026-06-19",
      "category": "japan"
    },
    {
      "id": "2026-06-21-019",
      "date": "2026-06-21",
      "category": "japan"
    },
    {
      "id": "2026-06-21-018",
      "date": "2026-06-21",
      "category": "japan"
    }
  ],
  "china_3": [
    {
      "id": "qbitai-qwen-robot",
      "date": "2026-06-16",
      "category": "china"
    },
    {
      "id": "2026-06-21-023",
      "date": "2026-06-21",
      "category": "china"
    },
    {
      "id": "2026-06-21-022",
      "date": "2026-06-21",
      "category": "china"
    },
    {
      "id": "qbitai-abot-earth0-5-hugging-face",
      "date": "2026-06-19",
      "category": "china"
    }
  ],
  "keyword_cloud": [
    { "keyword": "fable-5", "count": 12, "delta_vs_prev_week": 12 },
    { "keyword": "agents", "count": 12, "delta_vs_prev_week": -12 },
    { "keyword": "anthropic", "count": 10, "delta_vs_prev_week": -4 },
    { "keyword": "open-source", "count": 10, "delta_vs_prev_week": -2 },
    { "keyword": "GLM-5.2", "count": 9, "delta_vs_prev_week": 9 },
    { "keyword": "regulation", "count": 8, "delta_vs_prev_week": 8 },
    { "keyword": "export-control", "count": 8, "delta_vs_prev_week": 8 },
    { "keyword": "LLM", "count": 8, "delta_vs_prev_week": -1 },
    { "keyword": "japan", "count": 8, "delta_vs_prev_week": -1 },
    { "keyword": "benchmark", "count": 7, "delta_vs_prev_week": -5 },
    { "keyword": "white-house", "count": 6, "delta_vs_prev_week": 6 },
    { "keyword": "claude-code", "count": 6, "delta_vs_prev_week": -10 },
    { "keyword": "alignment", "count": 5, "delta_vs_prev_week": -1 },
    { "keyword": "robotics", "count": 5, "delta_vs_prev_week": 5 },
    { "keyword": "multimodal", "count": 5, "delta_vs_prev_week": -9 },
    { "keyword": "api", "count": 5, "delta_vs_prev_week": 0 },
    { "keyword": "xAI", "count": 4, "delta_vs_prev_week": 4 },
    { "keyword": "openai", "count": 4, "delta_vs_prev_week": -4 },
    { "keyword": "ai-safety", "count": 4, "delta_vs_prev_week": -2 },
    { "keyword": "china", "count": 4, "delta_vs_prev_week": 4 }
  ],
  "watchlist_next_week": [
    {
      "topic": "Claude Fable 5 輸出規制解除交渉",
      "reason": "AnthropicとWhite Houseの交渉継続中。予測市場で7月1日までに復活確率55%、6月26日まで30%。規制解除の有無がAI業界の規制モデルに直接影響",
      "watch_until": "2026-07-01",
      "source_item_id": "lesswrong-the-once-and-future-fable-3-fix-this-code"
    },
    {
      "topic": "Z.ai Open Fable モデル公開（2026年末予告）",
      "reason": "GLM-5.2のバイブチェック通過後、Z.aiが2026年12月までにFable相当オープンウェイトモデルの公開を予告。実現すれば閉鎖型フロンティアモデルとOSSの格差が解消",
      "watch_until": "2026-12-31",
      "source_item_id": "latent_space-ainews-glm-gpt-glm-5-2-passes-vibe-check-z-ai-fo"
    },
    {
      "topic": "理研「理究」AI特化スパコン稼働",
      "reason": "理化学研究所のAI専用スーパーコンピュータ「理究」が2026年7月稼働予定。国内AI研究の計算基盤として学術・企業の大規模LLM学習を担う",
      "watch_until": "2026-07-31",
      "source_item_id": "2026-06-21-021"
    },
    {
      "topic": "OpenAI IPO準備の加速",
      "reason": "Transformer共同考案者ノーム・シャジーア氏採用など著名人材を連続獲得。IPO前の組織体制強化が本格化しており、今後の資本政策・評価額の動向が焦点",
      "watch_until": "2026-09-30",
      "source_item_id": "techcrunch-openai-is-bringing-on-some-big-guns-in-the-lead-"
    },
    {
      "topic": "AWSのAIチップ外販vsNvidia競争",
      "reason": "AWSが自社AIチップを外部データセンターへ販売する交渉を開始。CEOが「500億ドルの機会」と位置づけ。実現すればAI推論インフラ市場の競争構図が根本から変化",
      "watch_until": "2026-09-30",
      "source_item_id": "techcrunch-amazon-hopes-to-challenge-nvidia-more-directly-b"
    }
  ],
  "week_items_index": [
    { "id": "2026-06-21-001", "date": "2026-06-21", "category": "new_models", "source": "latent_space" },
    { "id": "2026-06-21-002", "date": "2026-06-21", "category": "tools_apps", "source": "xai" },
    { "id": "2026-06-21-003", "date": "2026-06-21", "category": "tools_apps", "source": "xai" },
    { "id": "2026-06-21-004", "date": "2026-06-21", "category": "tools_apps", "source": "huggingface" },
    { "id": "2026-06-21-005", "date": "2026-06-21", "category": "agents", "source": "google_deepmind" },
    { "id": "2026-06-21-006", "date": "2026-06-21", "category": "agents", "source": "openai" },
    { "id": "2026-06-21-007", "date": "2026-06-21", "category": "multimodal", "source": "xai" },
    { "id": "2026-06-21-008", "date": "2026-06-21", "category": "multimodal", "source": "wired" },
    { "id": "2026-06-21-009", "date": "2026-06-21", "category": "research_papers", "source": "arxiv" },
    { "id": "2026-06-21-010", "date": "2026-06-21", "category": "research_papers", "source": "nvidia" },
    { "id": "2026-06-21-011", "date": "2026-06-21", "category": "research_papers", "source": "arxiv" },
    { "id": "2026-06-21-012", "date": "2026-06-21", "category": "industry_business", "source": "bloomberg" },
    { "id": "2026-06-21-013", "date": "2026-06-21", "category": "industry_business", "source": "techcrunch" },
    { "id": "2026-06-21-014", "date": "2026-06-21", "category": "regulation_policy", "source": "wired" },
    { "id": "2026-06-21-015", "date": "2026-06-21", "category": "community_buzz", "source": "lesswrong" },